Title,Year,Genre,Director,Writer,Actors,Language,Country,BoxOffice
Logan,2017,Action,James Mangold,"James Mangold (story by), Scott Frank (screenplay by), James Mangold (screenplay by), Michael Green (screenplay by)","Hugh Jackman, Patrick Stewart, Dafne Keen, Boyd Holbrook","English, Spanish",USA,226276809
The Men Who Stare at Goats,2009,Comedy,Grant Heslov,"Jon Ronson (inspired by the book), Peter Straughan (screenplay)","George Clooney, Ewan McGregor, Jeff Bridges, Kevin Spacey","English, Arabic","USA, UK",32400000
Assassin's Creed,2016,Action,Justin Kurzel,"Michael Lesslie (screenplay by), Adam Cooper (screenplay by), Bill Collage (screenplay by)","Michael Fassbender, Marion Cotillard, Jeremy Irons, Brendan Gleeson","English, Spanish, Arabic","USA, France, UK, Hong Kong, Taiwan, Malta",54645723
Our Brand Is Crisis,2015,Comedy,David Gordon Green,"Peter Straughan (screenplay), Rachel Boynton (documentary)","Sandra Bullock, Billy Bob Thornton, Anthony Mackie, Joaquim de Almeida","English, Spanish",USA,4895965
Nitro Circus: The Movie,2012,Documentary,"Gregg Godfrey, Jeremy Rawle","Gregg Godfrey, Travis Pastrana, Jeremy Rawle","Travis Pastrana, Jolene Van Vugt, Tommy Passemante, Jim DeChamp",English,USA,3376905
Abacus: Small Enough to Jail,2016,Documentary,Steve James,N/A,"Neil Barofsky, Ti-Hua Chang, Margaret Colin, Justin Deas",English,USA,113278
Thelma,2017,Drama,Joachim Trier,"Eskil Vogt (screenplay), Joachim Trier (screenplay)","Eili Harboe, Kaya Wilkins, Henrik Rafaelsen, Ellen Dorrit Petersen","Norwegian, Swedish","Norway, France, Denmark, Sweden",147112
We Need to Talk About Kevin,2011,Drama,Lynne Ramsay,"Lynne Ramsay (screenplay), Rory Stewart Kinnear (screenplay), Lionel Shriver (novel)","Tilda Swinton, John C. Reilly, Ezra Miller, Jasper Newell",English,"UK, USA",1738692
The Last Exorcism,2010,Drama,Daniel Stamm,"Huck Botko, Andrew Gurland","Patrick Fabian, Ashley Bell, Iris Bahr, Louis Herthum",English,"France, USA",40990055
Final Destination 5,2011,Horror,Steven Quale,"Eric Heisserer, Jeffrey Reddick (characters)","Nicholas D'Agosto, Emma Bell, Miles Fisher, Ellen Wroe","English, Cantonese","USA, Canada, Singapore, Hong Kong",42500000
Ceremony,2010,Comedy,Max Winkler,Max Winkler,"Michael Angarano, Uma Thurman, Reece Thompson, Lee Pace",English,USA,21666
Strange Wilderness,2008,Adventure,Fred Wolf,"Peter Gaulke, Fred Wolf","Steve Zahn, Allen Covert, Jonah Hill, Kevin Heffernan",English,USA,6515869
The Stray,2017,Drama,Mitch Davis,"Parker Davis, Mitch Davis","Michael Cassidy, Sarah Lancaster, Connor Corum, Pluto",English,USA,1564482
Movie 43,2013,Comedy,"Elizabeth Banks, Steven Brill, Steve Carr, Rusty Cundieff, James Duffy, Griffin Dunne, Peter Farrelly, Patrik Forsberg, Will Graham, James Gunn, Brett Ratner, Jonathan van Tulleken, Bob Odenkirk","Rocky Russo, Jeremy Sosenko, Ricky Blitt, Rocky Russo (screenplay), Jeremy Sosenko (screenplay), Bill O'Malley (story), Will Graham, Jack Kukoda, Rocky Russo, Jeremy Sosenko, Matt Portenoy, Rocky Russo (screenplay), Jeremy Sosenko (screenplay), Claes Kjellstrom (story), Jonas Wittenmark (story), Tobias Carlson (story), Will Carlough, Jonathan van Tulleken, Elizabeth Shapiro, Patrik Forsberg, Olle Sarri, Jacob Fleisher, Greg Pritikin, Rocky Russo, Jeremy Sosenko, James Gunn","Dennis Quaid, Greg Kinnear, Common, Charlie Saxton",English,USA,8700000
Kinyarwanda,2011,Drama,Alrick Brown,"Alrick Brown (screenplay), Patricia Janvier (storyline consultant), Ishmael Ntihabose (story), Charles Plath (storyline consultant)","Cassandra Freeman, Edouard Bamporiki, Cleophas Kabasita, Mazimpaka Kennedy","English, Kinyarwanda","USA, France",21097
Union Square,2011,Drama,Nancy Savoca,"Nancy Savoca (screenplay), Mary Tobler (screenplay)","Mira Sorvino, Michael Sirow, Tammy Blanchard, Murray",English,USA,44830
The Pearl Button,2015,Documentary,Patricio Guzman,"Patricio Guzman (concept), Jackson Merrick","Martin Calderon, Cristina, Patricio Guzman, Ema Malig",Spanish,"France, Spain, Chile, Switzerland",1409
Brooklyn's Finest,2009,Crime,Antoine Fuqua,Michael C. Martin,"Richard Gere, Don Cheadle, Ethan Hawke, Wesley Snipes",English,USA,26746443
The German Doctor,2013,Drama,Lucia Puenzo,Lucia Puenzo,"Alex Brendemuhl, Natalia Oreiro, Diego Peretti, Elena Roger","Spanish, German, Hebrew","Argentina, Spain, Norway, France",414912
The Girl on the Train,2016,Crime,Tate Taylor,"Erin Cressida Wilson (screenplay by), Paula Hawkins (based on the novel by)","Emily Blunt, Haley Bennett, Rebecca Ferguson, Justin Theroux","English, Spanish",USA,75311445
GasLand,2010,Documentary,Josh Fox,Josh Fox,"Josh Fox, Dick Cheney, Pete Seeger, Richard Nixon",English,USA,30846
Elvis & Nixon,2016,Comedy,Liza Johnson,"Joey Sagal (screenplay), Hanala Sagal (screenplay), Cary Elwes (screenplay)","Michael Shannon, Kevin Spacey, Alex Pettyfer, Johnny Knoxville",English,USA,725324
Enter the Void,2009,Drama,Gaspar Noe,"Gaspar Noe, Lucile Hadzihalilovic (with the help of)","Paz de la Huerta, Nathaniel Brown, Cyril Roy, Olly Alexander","English, Japanese","France, Germany, Italy, Canada, Japan",336467
Cowboys & Aliens,2011,Action,Jon Favreau,"Roberto Orci (screenplay), Alex Kurtzman (screenplay), Damon Lindelof (screenplay), Mark Fergus (screenplay), Hawk Ostby (screenplay), Mark Fergus (screen story), Hawk Ostby (screen story), Steve Oedekerk (screen story), Scott Mitchell Rosenberg (Platinum Studios comic book)","Daniel Craig, Abigail Spencer, Buck Taylor, Matthew Taylor","English, Apache languages",USA,100215116
Ready,2011,Action,Anees Bazmee,"Rajan Aggarwal (screenplay co-writer), Ikram Akhtar (screenplay), Nisar Akhtar (additional dialogue), Farhad Bhiwandiwala (dialogue), Gopimohan (story), Rajeev Kaul (screenplay), Sajid (dialogue)","Salman Khan, Asin, Paresh Rawal, Mahesh Manjrekar","Hindi, English",India,910446
On the Other Side of the Tracks,2012,Action,David Charhon,"Eric Altmayer (original idea), Nicolas Altmayer (original idea), David Charhon (screenplay), Alexis Dolivet (adaptation), Remy Four (screenplay), Laurent Lafitte (adaptation), Julien War (screenplay)","Omar Sy, Laurent Lafitte, Sabrina Ouazani, Lionel Abelanski",French,France,5923
Tokyo Sonata,2008,Drama,Kiyoshi Kurosawa,"Kiyoshi Kurosawa (screenplay), Max Mannix, Sachiko Tanaka (screenplay)","Teruyuki Kagawa, Kyoko Koizumi, Yu Koyanagi, Kai Inowaki",Japanese,"Japan, Netherlands, Hong Kong",103045
From Nowhere,2016,Drama,Matthew Newton,"Matthew Newton, Kate Ballen","Sydni Beaudoin, Helen Beyene, Erica Camarano, Joseph Castillo-Midyett",English,USA,5408
A Royal Night Out,2015,Comedy,Julian Jarrold,"Trevor De Silva, Kevin Hood","Sarah Gadon, Bel Powley, Emily Watson, Rupert Everett",English,UK,1626909
Masss,2015,Action,Venkat Prabhu,"D.S. Kannan, Madhan Karky (dialogue), Venkat Prabhu","Suriya, Nayanthara, Parthiban, Samuthirakani","Tamil, Telugu",India,85951
The Extraordinary Adventures of Adele Blanc-Sec,2010,Action,Luc Besson,"Luc Besson (screenplay), Jacques Tardi (comic books)","Louise Bourgoin, Mathieu Amalric, Gilles Lellouche, Jean-Paul Rouve","French, English, Spanish","France, USA",123614
This Means War,2012,Action,McG,"Timothy Dowling (screenplay), Simon Kinberg (screenplay), Timothy Dowling (story), Marcus Gautesen (story)","Reese Witherspoon, Chris Pine, Tom Hardy, Til Schweiger","English, German, Japanese, Serbian",USA,54758461
Pain & Gain,2013,Action,Michael Bay,"Christopher Markus (screenplay), Stephen McFeely (screenplay), Pete Collins (based on the magazine articles by)","Mark Wahlberg, Dwayne Johnson, Anthony Mackie, Tony Shalhoub",English,USA,49300000
Our Kind of Traitor,2016,Crime,Susanna White,"John le Carre (based on the novel by), Hossein Amini","Carlos Acosta, Radivoje Bukvic, Stellan Skarsgard, Mariya Fomina","English, Russian, French","UK, France",3152725
Skateland,2010,Drama,Anthony Burns,"Anthony Burns, Brandon Freeman, Heath Freeman","Shiloh Fernandez, Ashley Greene, Heath Freeman, Brett Cullen",English,USA,13612
Monsters vs. Aliens,2009,Animation,"Rob Letterman, Conrad Vernon","Maya Forbes (screenplay), Wallace Wolodarsky (screenplay), Rob Letterman (screenplay), Jonathan Aibel (screenplay), Glenn Berger (screenplay), Rob Letterman (story), Conrad Vernon (story)","Reese Witherspoon, Seth Rogen, Hugh Laurie, Will Arnett",English,USA,198332128
The Last Exorcism Part II,2013,Drama,Ed Gass-Donnelly,"Damien Chazelle (screenplay), Ed Gass-Donnelly (screenplay), Damien Chazelle (story), Huck Botko (characters created by), Andrew Gurland (characters created by)","Ashley Bell, Julia Garner, Spencer Treat Clark, David Jensen",English,"France, USA",15200000
Honey 2,2011,Comedy,Bille Woodruff,"Alyson Fouse, Blayne Weaver","Gee Alexander, Gerry Bednob, Aaron Benjamin, Ariana Berlin",English,USA,696794
Power Rangers,2017,Action,Dean Israelite,"John Gatins (screenplay by), Matt Sazama (story by), Burk Sharpless (story by), Michele Mulroney (story by), Kieran Mulroney (story by), Haim Saban (based upon ""Power Rangers"" created by), Saburo Yatsude (television series: ""Super Sentai""), Shotaro Ishinomori (television series: ""Super Sentai"")","Dacre Montgomery, Naomi Scott, RJ Cyler, Ludi Lin","English, Mandarin","USA, Hong Kong, Japan, Mexico, Canada, New Zealand",85275488
M.S. Dhoni: The Untold Story,2016,Biography,Neeraj Pandey,"Neeraj Pandey (story and dialogue), Neeraj Pandey (screenplay), Dilip Jha (screenplay), Mohinder Pratap Singh (writing associate), Shyam Maheshwari (writing associate)","Sushant Singh Rajput, Kiara Advani, Anupam Kher, Disha Patani",Hindi,India,1782795
Queen to Play,2009,Drama,Caroline Bottaro,"Caroline Bottaro, Bertina Henrichs (novel)","Sandrine Bonnaire, Kevin Kline, Francis Renaud, Jennifer Beals","French, English","France, Germany",478572
Experimenter,2015,Biography,Michael Almereyda,Michael Almereyda,"John Palladino, Anthony Edwards, Jim Gaffigan, Peter Sarsgaard",English,USA,155075
Seven Days in Utopia,2011,Drama,Matthew Dean Russell,"David L. Cook (screenplay), Rob Levine (screenplay), Matthew Dean Russell (screenplay), Sandra Thrift (screenplay), David L. Cook (novel)","Robert Duvall, Lucas Black, Melissa Leo, Deborah Ann Woll",English,USA,4367448
Black Swan,2010,Drama,Darren Aronofsky,"Mark Heyman (screenplay), Andres Heinz (screenplay), John J. McLaughlin (screenplay), Andres Heinz (story)","Natalie Portman, Mila Kunis, Vincent Cassel, Barbara Hershey","English, French, Italian",USA,106952327
Love and Honor,2013,Drama,Danny Mooney,"Jim Burnstein, Garrett K. Schiff","Liam Hemsworth, Austin Stowell, Teresa Palmer, Aimee Teegarden",English,USA,10534
Non-Stop,2014,Action,Jaume Collet-Serra,"John W. Richardson (screenplay), Christopher Roach (screenplay), Ryan Engle (screenplay), John W. Richardson (story), Christopher Roach (story)","Liam Neeson, Julianne Moore, Scoot McNairy, Michelle Dockery","English, German","UK, France, USA, Canada",80432029
Gulliver's Travels,2010,Adventure,Rob Letterman,"Joe Stillman (screenplay), Nicholas Stoller (screenplay), Jonathan Swift (book)","Jack Black, Jason Segel, Emily Blunt, Amanda Peet",English,USA,42776259
Hyde Park on Hudson,2012,Biography,Roger Michell,Richard Nelson,"Bill Murray, Laura Linney, Samuel West, Olivia Colman",English,UK,6367780
The Legend of Tarzan,2016,Action,David Yates,"Adam Cozad (screenplay by), Craig Brewer (screenplay by), Craig Brewer (story by), Adam Cozad (story by), Edgar Rice Burroughs (based on the ""Tarzan"" stories created by)","Alexander Skarsgard, Rory J. Saper, Christian Stevens, Christoph Waltz","English, Lingala, French","UK, Canada, USA",126585313
Shrek Forever After,2010,Animation,Mike Mitchell,"William Steig (based upon the book by), Josh Klausner, Darren Lemke, Matthew Shire (Punch-Up Writer)","Mike Myers, Eddie Murphy, Cameron Diaz, Antonio Banderas",English,USA,238319043
Alive Inside,2014,Documentary,Michael Rossato-Bennett,Michael Rossato-Bennett,"Dan Cohen, Louise Dueno, Nell Hardie, Norman Hardie",English,USA,150197
13 Assassins,2010,Action,Takashi Miike,"Kaneo Ikegami (based on a screenplay by), Shoichirou Ikemiya (story), Daisuke Tengan (screenplay)","Koji Yakusho, Takayuki Yamada, Yusuke Iseya, Ikki Sawamura",Japanese,"Japan, UK",802524
Bajirao Mastani,2015,Action,Sanjay Leela Bhansali,"Nagnath S. Inamdar (novel), Sanjay Leela Bhansali (additional writer), Prakash Kapadia","Ranveer Singh, Deepika Padukone, Priyanka Chopra, Tanvi Azmi",Hindi,India,6557047
Song of Granite,2017,Biography,Pat Collins,"Pat Collins, Eoghan Mac Giolla Bhride, Sharon Whooley","Michael O'Chonfhlaola, Macdara O Fatharta, Jaren Cerf, Pol O Ceannabhain","Irish, English","Ireland, Canada",4230
The Cove,2009,Documentary,Louie Psihoyos,Mark Monroe,"Richard O'Barry, Louie Psihoyos, Hardy Jones, Michael Illiff","English, Japanese",USA,619467
Buck,2011,Documentary,Cindy Meehl,N/A,"Buck Brannaman, Gary Myers, Bibb Frazier, Betty Staley",English,USA,4023123
Billu,2009,Comedy,Priyadarshan,"Manisha Korde (dialogue), Priyadarshan (screenplay), Mushtaq Sheikh (screenplay), Sreenivasan (story)","Irrfan Khan, Lara Dutta, Om Puri, Asrani","Hindi, Awadhi",India,698910
Fat Pizza vs. Housos,2014,Comedy,Paul Fenech,Paul Fenech,"Angry Anderson, Ashley Avci, Tahir Bilgic, Persia Blue",English,Australia,400616
Son of God,2014,Biography,Christopher Spencer,"Richard Bedser, Christopher Spencer, Colin Swash, Nic Young","Diogo Morgado, Greg Hicks, Adrian Schiller, Darwin Shaw","English, Hebrew",USA,46305287
Beloved Sisters,2014,Drama,Dominik Graf,Dominik Graf (screenplay),"Hannah Herzsprung, Florian Stetter, Henriette Confurius, Claudia Messner","German, French","Germany, Austria, Switzerland",34958
Mubarakan,2017,Comedy,Anees Bazmee,"Rupinder Chahal (story), Rajesh Chawla (dialogue), Balwinder Singh Janjua (screenplay), Balwinder Singh Janjua (story)","Anil Kapoor, Arjun Kapoor, Ileana D'Cruz, Athiya Shetty",Hindi,India,757057
A Cat in Paris,2010,Animation,"Jean-Loup Felicioli, Alain Gagnol","Alain Gagnol (screenplay), Jacques-Remy Girerd (dialogue), Alain Gagnol (dialogue)","Dominique Blanc, Bernadette Lafont, Bruno Salomone, Jean Benguigui",French,"France, Belgium",287709
Agent Vinod,2012,Action,Sriram Raghavan,"Arijit Biswas (story), Sriram Raghavan (story)","Kareena Kapoor, Saif Ali Khan, Adil Hussain, Gulshan Grover",Hindi,India,632446
The Warrior's Way,2010,Action,Sngmoo Lee,Sngmoo Lee,"Dong-Gun Jang, Kate Bosworth, Geoffrey Rush, Danny Huston",English,"New Zealand, South Korea",5664251
The Light Between Oceans,2016,Drama,Derek Cianfrance,"Derek Cianfrance (written for the screen by), M.L. Stedman (novel)","Michael Fassbender, Alicia Vikander, Rachel Weisz, Florence Clery",English,"UK, New Zealand, USA",12533911
The Best Offer,2013,Crime,Giuseppe Tornatore,Giuseppe Tornatore (story and screenplay),"Geoffrey Rush, Jim Sturgess, Sylvia Hoeks, Donald Sutherland",English,Italy,85433
Zokkomon,2011,Action,Satyajit Bhatkal,"Javed Akhtar (lyrics), Satyajit Bhatkal (story & screenplay), Svati Chakravarty Bhatkal (story & screenplay), Lancy Fernandes (story & screenplay), Divy Nidhi Sharma (dialogues)","Darsheel Safary, Anupam Kher, Manjari Fadnnis, Tinnu Anand","Hindi, English",India,2815
Life of Crime,2013,Comedy,Daniel Schechter,"Daniel Schechter (written for the screen by), Elmore Leonard (based on the book ""The Switch"" written by)","Jennifer Aniston, Yasiin Bey, Isla Fisher, Will Forte",English,USA,261695
Mid-August Lunch,2008,Comedy,Gianni Di Gregorio,"Gianni Di Gregorio (story), Simone Riccardini (story), Gianni Di Gregorio (screenplay)","Valeria De Franciscis, Marina Cacciotti, Maria Cali, Grazia Cesarini Sforza",Italian,Italy,600000
A Dark Truth,2012,Action,Damian Lee,Damian Lee,"Lloyd Adams, Alfredo Alvarez Calderon, Josh Bainbridge, Danielle Baker",English,Canada,5750
No,2012,Drama,Pablo Larrain,"Pedro Peirano (screenplay), Antonio Skarmeta (play)","Gael Garcia Bernal, Alfredo Castro, Luis Gnecco, Nestor Cantillana",Spanish,"Chile, France, Mexico, USA",2341226
Journey 2: The Mysterious Island,2012,Action,Brad Peyton,"Brian Gunn (screenplay), Mark Gunn (screenplay), Richard Outten (story), Brian Gunn (story), Mark Gunn (story), Jules Verne (novel)","Dwayne Johnson, Michael Caine, Josh Hutcherson, Luis Guzman",English,USA,103812241
The Gunman,2015,Action,Pierre Morel,"Jean-Patrick Manchette (novel), Don MacPherson (screenplay), Pete Travis (screenplay), Sean Penn (screenplay)","Sean Penn, Jasmine Trinca, Javier Bardem, Ray Winstone","English, Spanish","USA, Spain, UK, France",7926657
Daddy's Home Two,2017,Comedy,Sean Anders,"Sean Anders, John Morris, Brian Burns (based on characters created by)","Will Ferrell, Mark Wahlberg, Mel Gibson, John Lithgow","English, Spanish",USA,102934995
Contraband,2012,Action,Baltasar Kormakur,"Aaron Guzikowski (screenplay), Arnaldur Indridason (film ""Reykjavik-Rotterdam""), Oskar Jonasson (film ""Reykjavik-Rotterdam"")","Robert Wahlberg, Caleb Landry Jones, Jason Mitchell, Paul LeBlanc","English, Spanish","USA, UK, France",66489425
Kingsman: The Secret Service,2014,Action,Matthew Vaughn,"Jane Goldman (screenplay by), Matthew Vaughn (screenplay by), Mark Millar (based on the comic book ""The Secret Service"" by), Dave Gibbons (based on the comic book ""The Secret Service"" by)","Adrian Quinton, Colin Firth, Mark Strong, Jonno Davies","English, Arabic, Swedish","UK, USA",119469511
A Dangerous Method,2011,Biography,David Cronenberg,"Christopher Hampton (screenplay), Christopher Hampton (play), John Kerr (book)","Keira Knightley, Viggo Mortensen, Michael Fassbender, Vincent Cassel",English,"UK, Germany, Canada, Switzerland, USA",5702083
Jawani Phir Nahi Ani,2015,Adventure,Nadeem Beyg,Vasay Chaudhry,"Hamza Abbasi, Humayun Saeed, Vasay Chaudhry, Ahmad Ali Butt",Urdu,Pakistan,2256403
After the Ball,2015,Comedy,Sean Garrity,"Jason Sherman (screenplay), Kate Melville (screenplay), Jason Sherman (story), Lana Griffin (story editor), Katie Ford (story consultant), Diane Flacks (story consultant), Albert Howell (story consultant), Rob Stefaniuk (story consultant), Sarah Constible (story consultant)","Portia Doubleday, Marc-Andre Grondin, Chris Noth, Lauren Holly","English, French, Italian",Canada,160165
Beyond the Black Rainbow,2010,Horror,Panos Cosmatos,Panos Cosmatos,"Michael Rogers, Eva Bourne, Scott Hylands, Rondel Reynoldson",English,Canada,56129
My Little Pony: The Movie,2017,Animation,Jayson Thiessen,"Meghan McCarthy (story by), Joe Ballarini (story by), Meghan McCarthy (screenplay by), Rita Hsiao (screenplay by), Michael Vogel (screenplay by), Lauren Faust (based on the television series created by)","Uzo Aduba, Ashleigh Ball, Adam Bengis, Emily Blunt",English,"USA, Canada",21732671
Safe Haven,2013,Drama,Lasse Hallstrom,"Dana Stevens (screenplay), Gage Lansky (screenplay), Nicholas Sparks (based upon the novel by)","Julianne Hough, Irene Ziegler, Jon Kohler, Tim Parati","English, Portuguese",USA,71100000
Father Figures,2017,Adventure,Lawrence Sher,Justin Malen,"Robert Jon Mello, Ed Helms, Retta, Zachary Haven",English,USA,16772934
Micmacs,2009,Action,Jean-Pierre Jeunet,"Jean-Pierre Jeunet (scenario), Guillaume Laurant (scenario), Guillaume Laurant (dialogue)","Dany Boon, Andre Dussollier, Yolande Moreau, Dominique Pinon",French,France,1260917
The Road,2009,Adventure,John Hillcoat,"Joe Penhall (screenplay by), Cormac McCarthy (based on the book by)","Viggo Mortensen, Kodi Smit-McPhee, Robert Duvall, Guy Pearce",English,USA,8025059
And Everything Is Going Fine,2010,Documentary,Steven Soderbergh,N/A,Spalding Gray,English,USA,21073
A Ghost Story,2017,Drama,David Lowery,David Lowery,"Casey Affleck, Rooney Mara, McColm Cephas Jr., Kenneisha Thompson",English,USA,1594798
Smash & Grab: The Story of the Pink Panthers,2013,Documentary,Havana Marking,N/A,"Tomislav Tom Benzon, Daniel Vivian, Jasmin Topalusic, Rob Kennedy",English,"UK, USA, Serbia and Montenegro",18658
Manny Lewis,2015,Comedy,Anthony Mir,"Carl Barron, Anthony Mir, Carl Barron (story)","Carl Barron, Leeanna Walsman, Roy Billing, Damien Garvey",English,Australia,205435
Jason Bourne,2016,Action,Paul Greengrass,"Paul Greengrass, Christopher Rouse, Robert Ludlum (based on characters created by)","Matt Damon, Tommy Lee Jones, Alicia Vikander, Vincent Cassel","English, Greek, German, Japanese","USA, China",162162120
A Beginner's Guide to Snuff,2016,Comedy,Mitchell Altieri,"Cory Knauf, Adam Weis, Mitchell Altieri, Cory Knauf (story), Phil Flores (story), Mitchell Altieri (story)","Joey Kern, Luke Edwards, Bree Williamson, Brad Greenquist",English,USA,5204
Butter,2011,Comedy,Jim Field Smith,Jason A. Micallef,"Jennifer Garner, Ty Burrell, Garrett Schenck, Kristen Schaal",English,USA,70931
Potiche,2010,Comedy,Francois Ozon,"Francois Ozon (scenario), Pierre Barillet (play), Jean-Pierre Gredy (play)","Catherine Deneuve, Gerard Depardieu, Fabrice Luchini, Karin Viard",French,France,900000
On the Road,2012,Adventure,Walter Salles,"Jack Kerouac (based on the novel by), Jose Rivera (screenplay by)","Sam Riley, Garrett Hedlund, Kristen Stewart, Amy Adams","English, French","France, USA, UK, Brazil, Canada, Argentina",665094
[REC] 4: Apocalypse,2014,Horror,Jaume Balaguero,"Jaume Balaguero (screenplay), Manu Diez (screenplay)","Manuela Velasco, Paco Manzanedo, Hector Colome, Ismael Fritschi",Spanish,Spain,708
The Back-up Plan,2010,Comedy,Alan Poul,Kate Angelo,"Jennifer Lopez, Alex O'Loughlin, Michaela Watkins, Eric Christian Olsen",English,USA,37481242
The Forest,2016,Horror,Jason Zada,"Nick Antosca, Sarah Cornwell, Ben Ketai","Natalie Dormer, Eoin Macken, Stephanie Vogt, Osamu Tanpopo","English, Japanese",USA,21818536
Please Give,2010,Comedy,Nicole Holofcener,Nicole Holofcener,"Rebecca Hall, Elizabeth Keener, Elise Ivy, Catherine Keener",English,USA,4033268
Ponyo,2008,Animation,Hayao Miyazaki,Hayao Miyazaki,"Tomoko Yamaguchi, Kazushige Nagashima, Yuki Amami, George Tokoro",Japanese,Japan,15100000
My All-American,2015,Biography,Angelo Pizzo,"Angelo Pizzo, Jim Dent (book)","Aaron Eckhart, Finn Wittrock, Rett Terrell, Michael Reilly Burke",English,USA,1365000
Django Unchained,2012,Drama,Quentin Tarantino,Quentin Tarantino,"Jamie Foxx, Christoph Waltz, Leonardo DiCaprio, Kerry Washington","English, German, French, Italian",USA,162804648
A Band Called Death,2012,Documentary,"Mark Christopher Covino, Jeff Howlett",N/A,"Dannis Hackney, Bobby Hackney, David Hackney, Robbie Duncan",English,USA,125856
Safe House,2012,Action,Daniel Espinosa,David Guggenheim,"Denzel Washington, Ryan Reynolds, Vera Farmiga, Brendan Gleeson","English, Afrikaans","South Africa, Japan, USA",126149655
Boyhood,2014,Drama,Richard Linklater,Richard Linklater,"Ellar Coltrane, Patricia Arquette, Elijah Smith, Lorelei Linklater","English, Spanish",USA,18859617
Guardians of the Galaxy,2014,Action,James Gunn,"James Gunn, Nicole Perlman, Dan Abnett (based on the Marvel comics by), Andy Lanning (based on the Marvel comics by), Bill Mantlo (character created by: Rocket Raccoon), Keith Giffen (character created by: Rocket Raccoon), Jim Starlin (characters created by: Drax the Destroyer,  Gamora & Thanos), Steve Englehart (character created by: Star-Lord), Steve Gan (character created by: Star-Lord), Steve Gerber (character created by: Howard the Duck), Val Mayerik (character created by: Howard the Duck)","Chris Pratt, Zoe Saldana, Dave Bautista, Vin Diesel",English,USA,270592504
Racing Dreams,2009,Documentary,Marshall Curry,Marshall Curry,"Annabeth Barnes, Josh Hobson, Brandon Warren, Russ Wiles",English,USA,5529
Coco Chanel & Igor Stravinsky,2009,Drama,Jan Kounen,"Chris Greenhalgh (screenplay and dialogue), Chris Greenhalgh (novel), Carlo De Boutiny (adaptation), Jan Kounen (adaptation)","Mads Mikkelsen, Anna Mouglalis, Elena Morozova, Natacha Lindinger","French, Russian, English","France, Japan, Switzerland",1724882
The Girl with the Dragon Tattoo,2011,Crime,David Fincher,"Steven Zaillian (screenplay by), Stieg Larsson (novel)","Daniel Craig, Rooney Mara, Christopher Plummer, Stellan Skarsgard",English,"USA, Sweden, Norway",102515793
Detective Byomkesh Bakshy!,2015,Action,Dibakar Banerjee,"Urmi Juvekar, Dibakar Banerjee, Saradindu Bandopadhyay (based on the stories and characters created by)","Sushant Singh Rajput, Anand Tiwari, Neeraj Kabi, Divya Menon",Hindi,India,579055
Twelve,2010,Action,Joel Schumacher,"Jordan Melamed (screenplay), Nick McDonell (novel)","Chace Crawford, Rory Culkin, Philip Ettinger, Esti Ginzburg",English,"USA, France",18159100
A Beautiful Now,2015,Comedy,Daniela Amavia,"Daniela Amavia, Daniela Amavia","Abigail Spencer, Cheyenne Jackson, Collette Wolfe, Elena Satine",English,USA,1504
The Informant!,2009,Biography,Steven Soderbergh,"Scott Z. Burns (screenplay), Kurt Eichenwald (book)","Matt Damon, Lucas McHugh Carroll, Eddie Jemison, Rusty Schwimmer","English, German",USA,33278731
What's Your Number?,2011,Comedy,Mark Mylod,"Karyn Bosnak (novel), Gabrielle Allan (screenplay), Jennifer Crittenden (screenplay)","Anna Faris, Chris Evans, Ari Graynor, Blythe Danner",English,USA,14008193
Like Crazy,2011,Drama,Drake Doremus,"Drake Doremus, Ben York Jones","Anton Yelchin, Felicity Jones, Jennifer Lawrence, Charlie Bewley",English,USA,3388210
The Sessions,2012,Biography,Ben Lewin,"Ben Lewin (written for the screen by), Mark O'Brien (article)","John Hawkes, Helen Hunt, William H. Macy, Moon Bloodgood",English,USA,5997134
The Forbidden Kingdom,2008,Action,Rob Minkoff,John Fusco,"Jet Li, Michael Angarano, Jackie Chan, Juana Collignon","English, Mandarin","USA, China",40044561
Star Wars: Episode VII - The Force Awakens,2015,Action,J.J. Abrams,"Lawrence Kasdan, J.J. Abrams, Michael Arndt, George Lucas (based on characters created by)","Harrison Ford, Mark Hamill, Carrie Fisher, Adam Driver",English,USA,936658640
Exit Through the Gift Shop,2010,Documentary,Banksy,N/A,"Banksy, Mr. Brainwash, Debora Guetta, Space Invader","English, French",UK,3288699
