Title,Year,Genre,Director,Writer,Actors,Language,Country,BoxOffice
Sing,2016,Animation,"Garth Jennings, Christophe Lourdelet(co-director)",Garth Jennings,"Matthew McConaughey, Reese Witherspoon, Seth MacFarlane, Scarlett Johansson","English, Japanese, Ukrainian","Japan, USA",270322940
Sidewalls,2011,Comedy,Gustavo Taretto,Gustavo Taretto,"Javier Drolas, Miguel Dedovich, Pilar Lopez de Ayala, Miguel Alvarez","Spanish, French, English, Italian, German","Argentina, Spain, Germany",1304
The Attorney,2013,Drama,Woo-seok Yang,"Yoon Hyeon-ho, Woo-seok Yang","Kwang Soo Cha, Seon-Mook Cho, Ki-Jung Han, Sung-ho Hong",Korean,South Korea,347684
Star Wars: Episode VIII - The Last Jedi,2017,Action,Rian Johnson,"Rian Johnson, George Lucas (based on characters created by)","Mark Hamill, Carrie Fisher, Adam Driver, Daisy Ridley",English,USA,619117636
Bran Nue Dae,2009,Comedy,Rachel Perkins,"Jimmy Chi (stage musical), Kuckles (stage musical), Patrick Duttoo Bin Amat (stage musical), Garry Gower (stage musical), Michael Manolis Mavromatis (stage musical), Stephen Pigram (stage musical), Reg Cribb (screenplay), Rachel Perkins (screenplay), Jimmy Chi (screenplay), Adrian Russell Wills","Rocky McKenzie, Jessica Mauboy, Ernie Dingo, Missy Higgins",English,Australia,100000
1945,2017,Drama,Ferenc Torok,"Gabor T. Szanto, Ferenc Torok","Peter Rudolf, Bence Tasnadi, Tamas Szabo Kimmel, Dora Sztarenki","Hungarian, Russian",Hungary,258392
Hide Away,2011,Drama,Chris Eyre,Peter Vanderwall,"Josh Lucas, Ayelet Zurer, James Cromwell, Jon Tenney",English,USA,29604
Youth,2015,Comedy,Paolo Sorrentino,Paolo Sorrentino,"The Retrosettes, Gabriella Belisario, Laura De Marchi, Rachel Weisz","English, Spanish, Swiss German","Italy, France, UK, Switzerland",1882275
Think Like a Man,2012,Comedy,Tim Story,"Keith Merryman (screenplay), David A. Newman (screenplay), Steve Harvey (book)","Michael Ealy, Jerry Ferrara, Meagan Good, Regina Hall",English,USA,91547205
Valley of Bones,2017,Crime,Dan Glaser,"Dan Glaser, Steven Molony, Richard M. Lewis, Jon Wanzek (story by)","Autumn Reeser, Rhys Coiro, Steven Molony, Mason Mahay",English,USA,168387
Five Broken Cameras,2011,Documentary,"Emad Burnat, Guy Davidi",N/A,"Emad Burnat, Soraya Burnat, Mohammed Burnat, Yasin Burnat","Hebrew, Arabic","Palestine, Israel, France, Netherlands",108541
Whip It,2009,Drama,Drew Barrymore,"Shauna Cross (screenplay), Shauna Cross (novel)","Sarah Habel, Shannon Eagen, Edward Austin Kelly, Mary Callaghan Lynch",English,USA,13000000
Wendy and Lucy,2008,Drama,Kelly Reichardt,"Jonathan Raymond (screenplay by), Kelly Reichardt (screenplay by), Jonathan Raymond (story by)","Michelle Williams, Lucy, David Koppell, Max Clement",English,USA,700720
The Family Tree,2011,Comedy,Vivi Friedman,Mark Lisson,"Rachael Leigh Cook, Hope Davis, Dermot Mulroney, Max Thieriot",English,"Australia, USA",3658
The Extra Man,2010,Comedy,"Shari Springer Berman, Robert Pulcini","Robert Pulcini (screenplay), Jonathan Ames (screenplay), Shari Springer Berman (screenplay), Jonathan Ames (novel)","Paul Dano, Marian Seldes, Celia Weston, Patti D'Arbanville",English,"France, USA",453079
Moonlight,2016,Drama,Barry Jenkins,"Barry Jenkins (screenplay by), Tarell Alvin McCraney (story by)","Mahershala Ali, Shariff Earp, Duan Sanderson, Alex R. Hibbert",English,USA,27850910
The Freebie,2010,Comedy,Katie Aselton,Katie Aselton,"Katie Aselton, Dax Shepard, Maggie Phillips, Joshua Leonard",English,USA,4500
Bangkok Dangerous,2008,Action,"Danny Pang, Oxide Chun Pang","Jason Richman (screenplay), Oxide Chun Pang, Danny Pang","Nicolas Cage, Shahkrit Yamnarm, Charlie Yeung, Panward Hemmanee","English, Thai",USA,15195406
Country Strong,2010,Drama,Shana Feste,Shana Feste,"Gwyneth Paltrow, Tim McGraw, Garrett Hedlund, Leighton Meester",English,USA,20218921
Dawson City: Frozen Time,2016,Documentary,Bill Morrison,Bill Morrison,"Kathy Jones-Gates, Michael Gates, Sam Kula, Bill O'Farrell",English,USA,122207
21 Jump Street,2012,Action,"Phil Lord, Christopher Miller","Michael Bacall (screenplay), Michael Bacall (story), Jonah Hill (story), Patrick Hasburgh (television series), Stephen J. Cannell (television series)","Jonah Hill, Channing Tatum, Brie Larson, Dave Franco",English,USA,134000000
[REC] 3: Genesis,2012,Horror,Paco Plaza,"Luiso Berdejo (screenplay), Paco Plaza (screenplay), Luiso Berdejo (story), Paco Plaza (story), David Gallart (story)","Leticia Dolera, Diego Martin, Ismael Martinez, Alex Monner","Spanish, Catalan, French",Spain,6921
Staying Vertical,2016,Comedy,Alain Guiraudie,Alain Guiraudie (screenplay),"Damien Bonnard, India Hair, Raphael Thiery, Christian Bouillette",French,France,11747
The Trials of Muhammad Ali,2013,Documentary,Bill Siegel,N/A,"Eamonn Andrews, Muhammad Ali, David Susskind, George W. Bush",English,USA,57607
Everybody's Fine,2009,Adventure,Kirk Jones,"Kirk Jones, Giuseppe Tornatore (original screenplay), Tonino Guerra (original screenplay), Massimo De Rita (original screenplay)","Robert De Niro, Drew Barrymore, Kate Beckinsale, Sam Rockwell",English,USA,8855646
Cold War II,2016,Action,"Lok Man Leung, Kim-Ching Luk","Lok Man Leung, Kim-Ching Luk, Wai Lun Ng","Aaron Kwok, Tony Ka Fai Leung, Yun-Fat Chow, Charlie Yeung","Cantonese, Mandarin, English","Hong Kong, China",553754
Peeples,2013,Comedy,Tina Gordon Chism,Tina Gordon Chism,"Craig Robinson, Kerry Washington, David Alan Grier, S. Epatha Merkerson",English,USA,9123834
Like Crazy,2011,Drama,Drake Doremus,"Drake Doremus, Ben York Jones","Anton Yelchin, Felicity Jones, Jennifer Lawrence, Charlie Bewley",English,USA,3388210
Free Birds,2013,Animation,Jimmy Hayward,"Scott Mosier (screenplay), Jimmy Hayward (screenplay), David I. Stern (story), John J. Strauss (story), Russell Leigh Sharman","Owen Wilson, Woody Harrelson, Amy Poehler, George Takei",English,USA,46667023
Fired Up!,2009,Comedy,Will Gluck,Will Gluck,"Nicholas D'Agosto, Eric Christian Olsen, Sarah Roemer, Molly Sims",English,USA,16755117
The Proposal,2009,Comedy,Anne Fletcher,Peter Chiarelli,"Sandra Bullock, Ryan Reynolds, Mary Steenburgen, Craig T. Nelson",English,USA,163900057
The Mysteries of Pittsburgh,2008,Adventure,Rawson Marshall Thurber,"Rawson Marshall Thurber (screenplay), Michael Chabon (novel)","Jon Foster, Peter Sarsgaard, Sienna Miller, Nick Nolte",English,"USA, Bahrain",32783
Little Men,2016,Drama,Ira Sachs,"Ira Sachs, Mauricio Zacharias","Greg Kinnear, Jennifer Ehle, Paulina Garcia, Michael Barbieri","English, Spanish","USA, Greece, Brazil",702191
The Incredible Hulk,2008,Action,Louis Leterrier,"Zak Penn (screenplay), Zak Penn (screen story), Stan Lee (Marvel comic book), Jack Kirby (Marvel comic book)","Edward Norton, Liv Tyler, Tim Roth, William Hurt","English, Portuguese, Spanish",USA,134518390
OK Jaanu,2017,Drama,Shaad Ali,"Mani Ratnam (story and screenplay), Gulzar (dialogue)","Shraddha Kapoor, Naseeruddin Shah, Aditya Roy Kapoor, Kitu Gidwani",Hindi,India,345872
Now You See Me 2,2016,Action,Jon M. Chu,"Ed Solomon (screenplay by), Ed Solomon (story by), Peter Chiarelli (story by), Boaz Yakin (based on characters created by), Edward Ricourt (based on characters created by)","Jesse Eisenberg, Mark Ruffalo, Woody Harrelson, Dave Franco","English, Mandarin, Cantonese","France, USA",65030563
Higher Ground,2011,Drama,Vera Farmiga,"Carolyn S. Briggs (screenplay), Tim Metcalfe (screenplay), Carolyn S. Briggs (memoir ""This Dark World"")","Joshua Leonard, Norbert Leo Butz, Michael Chernus, Vera Farmiga",English,USA,841056
The Jungle Book,2016,Adventure,Jon Favreau,"Justin Marks (screenplay by), Rudyard Kipling (based on the books by)","Neel Sethi, Bill Murray, Ben Kingsley, Idris Elba",English,"UK, USA",363995937
Salt,2010,Action,Phillip Noyce,Kurt Wimmer,"Angelina Jolie, Liev Schreiber, Chiwetel Ejiofor, Daniel Olbrychski","English, Russian, Korean",USA,118311368
The Bullet Vanishes,2012,Action,Chi-Leung Law,"Chi-Leung Law, Sin Ling Yeung (original story), Sin Ling Yeung","Nicholas Tse, Ching Wan Lau, Mi Yang, Boran Jing","Mandarin, Cantonese","China, Hong Kong",109172
The Girl in the Book,2015,Drama,Marya Cohn,Marya Cohn,"Emily VanCamp, Courtney Daniels, Jordan Lage, Ana Mulvoy Ten",English,USA,5249
Doomsday,2008,Action,Neil Marshall,Neil Marshall,"Caryn Peterson, Adeola Ariyo, Emma Cleasby, Christine Tomlinson",English,"UK, USA, South Africa, Germany",10955425
Spy Kids 4: All the Time in the World,2011,Action,Robert Rodriguez,Robert Rodriguez,"Jessica Alba, Joel McHale, Rowan Blanchard, Mason Cook",English,USA,38536376
The Secret of Kells,2009,Animation,"Tomm Moore, Nora Twomey(co-director)","Tomm Moore (original story), Fabrice Ziolkowski (screenplay)","Evan McGuire, Christen Mooney, Brendan Gleeson, Mick Lally","English, Irish","France, Belgium, Ireland",686383
Devil's Knot,2013,Biography,Atom Egoyan,"Paul Harris Boardman (screenplay), Scott Derrickson (screenplay), Mara Leveritt (book)","Reese Witherspoon, Colin Firth, Alessandro Nivola, James Hamrick",English,USA,122892
Survival of the Dead,2009,Comedy,George A. Romero,George A. Romero,"Alan Van Sprang, Joshua Peace, Hardee T. Lineham, Dru Viergever",English,"USA, Canada",1914
The Attack,2012,Drama,Ziad Doueiri,"Joelle Touma, Ziad Doueiri, Yasmina Khadra (novel)","Ali Suliman, Reymonde Amsallem, Evgenia Dodina, Dvir Benedek","Arabic, Hebrew","Lebanon, France, Qatar, Belgium",1103645
Sleepless,2017,Action,Baran bo Odar,"Andrea Berloff (screenplay by), Frederic Jardin (based on the film ""Nuit blanche"" written by), Nicolas Saada (based on the film ""Nuit blanche"" written by), Olivier Douyere (based on the film ""Nuit blanche"" written by)","Jamie Foxx, Michelle Monaghan, Scoot McNairy, Dermot Mulroney",English,USA,20757977
Approved for Adoption,2012,Animation,"Laurent Boileau, Jung","Laurent Boileau, Jung (also graphic novel)","Maxym Anciaux, Cathy Boquet, Mahe Collet, Christelle Cornil","French, Korean","France, Belgium, South Korea, Switzerland",4014
Despicable Me,2010,Animation,"Pierre Coffin, Chris Renaud","Cinco Paul (screenplay by), Ken Daurio (screenplay by), Sergio Pablos (based on a story by)","Steve Carell, Jason Segel, Russell Brand, Julie Andrews",English,"USA, France",251476985
Talaash,2012,Crime,Reema Kagti,"Farhan Akhtar (dialogue), Anurag Kashyap (additional dialogue), Zoya Akhtar (story), Reema Kagti (story), Zoya Akhtar (screenplay), Reema Kagti (screenplay)","Aamir Khan, Kareena Kapoor, Nawazuddin Siddiqui, Rajkummar Rao","Hindi, English, Marathi, Tamil",India,2706375
Chi-Raq,2015,Comedy,Spike Lee,"Kevin Willmott, Spike Lee, Aristophanes (play)","Nick Cannon, Teyonah Parris, Wesley Snipes, Angela Bassett",English,USA,2647378
The Smurfs 2,2013,Animation,Raja Gosnell,"J. David Stem (screenplay), David N. Weiss (screenplay), Jay Scherick (screenplay), David Ronn (screenplay), Karey Kirkpatrick (screenplay), J. David Stem (story), David N. Weiss (story), Jay Scherick (story), David Ronn (story), Peyo (characters and works)","Hank Azaria, Neil Patrick Harris, Brendan Gleeson, Jayma Mays","English, French","USA, France, Canada, Belgium",71017784
I Saw the Devil,2010,Action,Jee-woon Kim,"Jee-woon Kim (adaptation), Hoon-jung Park (screenplay)","Byung-Hun Lee, Min-sik Choi, Joon-Hyuk Lee, In-seo Kim",Korean,South Korea,128392
The Principle,2014,Documentary,Katheryne Thomas,Rick DeLano,"Julian Barbour, Robert J. Bennett, John Byl, Bernard J. Carr",English,USA,86172
Veer,2010,Action,Anil Sharma,"Shailesh Verma (screenplay & dialogue), Shaktimaan Talwar (screenplay & dialogue), Salman Khan (story), Pit Kuhlmann (script translation)","Salman Khan, Jackie Shroff, Mithun Chakraborty, Neena Gupta","Hindi, Urdu",India,499685
Ancien and the Magic Tablet,2017,Animation,Kenji Kamiyama,Kenji Kamiyama,"Mitsuki Takahata, Shinnosuke Mitsushima, Ray Chase, Ben Diskin","Japanese, English",Japan,46020
Dangal,2016,Action,Nitesh Tiwari,"Piyush Gupta, Shreyas Jain, Nikhil Mehrotra, Rajshri Sudhakar (Dialogue Writer: Telugu), Nitesh Tiwari","Aamir Khan, Fatima Sana Shaikh, Sanya Malhotra, Sakshi Tanwar","Hindi, Tamil, Telugu",India,12382287
Gran Torino,2008,Drama,Clint Eastwood,"Nick Schenk (screenplay), Dave Johannson (story), Nick Schenk (story)","Clint Eastwood, Christopher Carley, Bee Vang, Ahney Her","English, Hmong","Germany, USA",148055047
The 33,2015,Biography,Patricia Riggen,"Mikko Alanne (screenplay), Craig Borten (screenplay), Michael Thomas (screenplay), Jose Rivera (screen story), Hector Tobar (book)","Antonio Banderas, Rodrigo Santoro, Juliette Binoche, James Brolin","English, Spanish","Chile, USA",9144459
I'm in Love with a Church Girl,2013,Crime,Steve Race,Galley Molina,"Zahn McClarnon, Michael Madsen, Stephen Baldwin, Martin Kove",English,USA,2380405
About Cherry,2012,Drama,Stephen Elliott,"Stephen Elliott, Lorelei Lee","Ashley Hinshaw, Lili Taylor, Dev Patel, Diane Farr",English,USA,2760
All Is Lost,2013,Action,J.C. Chandor,J.C. Chandor,Robert Redford,English,USA,4300353
Pieta,2012,Crime,Ki-duk Kim,Ki-duk Kim,"Min-soo Jo, Jung-Jin Lee, Ki-Hong Woo, Eunjin Kang",Korean,South Korea,13177
The Last Women Standing,2015,Romance,Luo Luo,Luo Luo,"Qi Shu, Eddie Peng, Hong Pan, Shih-Chieh King",Mandarin,China,163017
The Night Before,2015,Adventure,Jonathan Levine,"Jonathan Levine (screenplay), Kyle Hunter (screenplay), Ariel Shaffir (screenplay), Evan Goldberg (screenplay), Jonathan Levine (story)","Joseph Gordon-Levitt, Seth Rogen, Anthony Mackie, Jillian Bell",English,USA,31315980
If You Build It,2013,Documentary,Patrick Creadon,N/A,"Erick Bowen, Rodecoe Dunlow, Kerron Hayes, Anthony Johnson",English,USA,11079
Decoding Annie Parker,2013,Drama,Steven Bernstein,"Adam Bernstein, Steven Bernstein, Michael Moss","Helen Hunt, Samantha Morton, Aaron Paul, Rashida Jones",English,USA,39850
A Green Story,2012,Biography,Nick Agiashvili,Nick Agiashvili,"Shannon Elizabeth, Ed O'Ross, Billy Zane, Annabella Sciorra","English, Greek, German","USA, Greece",12519
Good Neighbors,2010,Drama,Jacob Tierney,"Chrystine Brouillet (novel), Jacob Tierney","Jay Baruchel, Anne-Marie Cadieux, Diane D'Aquila, Xavier Dolan",English,Canada,6805
Diary of a Wimpy Kid,2010,Comedy,Thor Freudenthal,"Jackie Filgo (screenplay), Jeff Filgo (screenplay), Gabe Sachs (screenplay), Jeff Judah (screenplay), Jeff Kinney (book)","Zachary Gordon, Robert Capron, Rachael Harris, Steve Zahn","English, German","USA, UK",64001297
Wanted,2008,Action,Timur Bekmambetov,"Michael Brandt (screenplay), Derek Haas (screenplay), Chris Morgan (screenplay), Michael Brandt (story), Derek Haas (story), Mark Millar (comic book series), J.G. Jones (comic book series)","James McAvoy, Morgan Freeman, Angelina Jolie, Terence Stamp",English,"USA, Germany",134294280
Tonight You're Mine,2011,Comedy,David Mackenzie,Thomas Leveritt (screenplay),"Rebecca Benson, Luke Treadaway, Mathew Baynton, Natalia Tena",English,UK,5086
Run & Jump,2013,Drama,Steph Green,"Steph Green, Ailbhe Keogan","Ciara Gallagher, Maxine Peake, Edward MacLiam, Will Forte",English,"Ireland, Germany",6280
The Gatekeepers,2012,Documentary,Dror Moreh,N/A,"Ami Ayalon, Avi Dichter, Yuval Diskin, Carmi Gillon","Hebrew, English","Israel, France",2408553
The Boy,2016,Horror,William Brent Bell,Stacey Menear,"Lauren Cohan, Rupert Evans, James Russell, Jim Norton",English,"China, Canada, USA",30196680
Season of the Witch,2011,Action,Dominic Sena,Bragi F. Schut,"Nicolas Cage, Ron Perlman, Stephen Campbell Moore, Stephen Graham","English, Latin",USA,24800000
Evocateur: The Morton Downey Jr. Movie,2012,Documentary,"Seth Kramer, Daniel A. Miller, Jeremy Newberger",Daniel A. Miller,"Morton Downey Jr., Glenn Beck, Victoria Jackson, Bob Pittman",English,USA,21476
"The Goods: Live Hard, Sell Hard",2009,Comedy,Neal Brennan,"Andy Stock, Rick Stempson","Jeremy Piven, Ving Rhames, James Brolin, David Koechner",English,USA,15000327
Nas: Time Is Illmatic,2014,Documentary,One9,Erik Parker,"Nas, Cornel West, Pharrell Williams, Swizz Beatz",English,USA,151366
Jagga Jasoos,2017,Action,Anurag Basu,"Anurag Basu (story and screenplay), Amitabh Bhattacharya (dialogue), Debatma Mandal (dialogue), Samrat Chakraborty (dialogue), Anurag Basu (dialogue)","Ranbir Kapoor, Katrina Kaif, Saswata Chatterjee, Chitrak Bandyopadhyay",Hindi,India,854064
Western,2017,Drama,Valeska Grisebach,Valeska Grisebach,"Meinhard Neumann, Reinhardt Wetrek, Syuleyman Alilov Letifov, Veneta Fragnova","German, Bulgarian, English","Germany, Bulgaria, Austria",34215
Furious 7,2015,Action,James Wan,"Chris Morgan, Gary Scott Thompson (characters)","Vin Diesel, Paul Walker, Jason Statham, Michelle Rodriguez","English, Thai, Arabic, Spanish","Japan, USA, China, United Arab Emirates",316986481
Go for Sisters,2013,Crime,John Sayles,John Sayles,"LisaGay Hamilton, Edward James Olmos, Yolonda Ross, Hilary Barraford","English, Spanish",USA,55963
Rhymes for Young Ghouls,2013,Crime,Jeff Barnaby,Jeff Barnaby,"Devery Jacobs, Glen Gould, Brandon Oakes, Roseanne Supernault","English, Micmac",Canada,3257
Smart People,2008,Comedy,Noam Murro,Mark Poirier,"Dennis Quaid, Sarah Jessica Parker, Thomas Haden Church, Ellen Page","English, Spanish",USA,9496882
2012,2009,Action,Roland Emmerich,"Roland Emmerich, Harald Kloser","John Cusack, Amanda Peet, Chiwetel Ejiofor, Thandie Newton","English, French, Tibetan, Mandarin, Russian, Hindi, Portuguese, Latin, Italian, Spanish",USA,166112167
Trespass,2011,Crime,Joel Schumacher,Karl Gajdusek,"Nicolas Cage, Nicole Kidman, Ben Mendelsohn, Liana Liberato",English,"USA, Bulgaria",16816
Just Before I Go,2014,Comedy,Courteney Cox,David Flebotte,"Seann William Scott, Olivia Thirlby, Garret Dillahunt, Kate Walsh",English,USA,8129
Gamer,2009,Action,"Mark Neveldine, Brian Taylor","Mark Neveldine, Brian Taylor","Gerard Butler, Amber Valletta, Michael C. Hall, Kyra Sedgwick",English,USA,20488579
Goat,2016,Drama,Andrew Neel,"David Gordon Green, Brad Land (memoir), Andrew Neel, Mike Roberts","Ben Schnetzer, Nick Jonas, Gus Halper, Danny Flaherty",English,USA,23020
The Choice,2016,Drama,Ross Katz,"Bryan Sipe (screenplay), Nicholas Sparks (novel)","Benjamin Walker, Teresa Palmer, Maggie Grace, Alexandra Daddario",English,USA,15285347
Soul Kitchen,2009,Comedy,Fatih Akin,"Fatih Akin (screenplay), Adam Bousdoukos (screenplay)","Adam Bousdoukos, Moritz Bleibtreu, Pheline Roggan, Anna Bederke","German, Greek, Spanish, Turkish, English","Germany, France, Italy",200000
Mia and the Migoo,2008,Animation,Jacques-Remy Girerd,"Benoit Chieux (screenplay), Jacques-Remy Girerd, Antoine Lanciaux (screenplay), Stephanie Sheh (adaptation), Iouri Tcherenkov (screenplay)","Dany Boon, John DiMaggio, Garance Lagraa, Charlie Girerd",French,"France, Italy",16975
Rangeelay,2013,Action,Navaniat Singh,Dheeraj Rattan (story & screeplay),"Binnu Dhillon, Jaswinder Bhalla, Rana Ranbir, Shavinder Mahal",Panjabi,India,139074
The Transfiguration,2016,Drama,Michael O'Shea,Michael O'Shea,"Eric Ruffin, Karin Cherches, Luis Scott, Dangelo Bonneli",English,USA,21926
The Eye,2008,Horror,"David Moreau, Xavier Palud","Sebastian Gutierrez (screenplay), Yuet-Jan Hui, Oxide Chun Pang, Danny Pang","Jessica Alba, Alessandro Nivola, Parker Posey, Rade Serbedzija","English, Spanish","USA, Canada",31400000
The Time that Remains,2009,Drama,Elia Suleiman,Elia Suleiman,"Ali Suliman, Maisa Abd Elhadi, Saleh Bakri, Elia Suleiman","Arabic, Hebrew, English","UK, Italy, Belgium, France, Palestine",31788
A Little Bit of Heaven,2011,Comedy,Nicole Kassell,Gren Wells,"Kate Hudson, Gael Garcia Bernal, Kathy Bates, Lucy Punch",English,USA,453167
Inspector Bellamy,2009,Crime,Claude Chabrol,"Odile Barski (scenario,  adaptation and dialogue), Claude Chabrol (scenario,  adaptation and dialogue)","Gerard Depardieu, Clovis Cornillac, Jacques Gamblin, Marie Bunel",French,France,105893
Red Army,2014,Documentary,Gabe Polsky,Gabe Polsky,"Scotty Bowman, Herb Brooks, Don Cherry, Mark Deakins","English, Russian","USA, Russia",694600
No One Lives,2012,Horror,Ryuhei Kitamura,David Cohen,"Luke Evans, Adelaide Clemens, Lee Tergesen, Derek Magyar",English,"USA, UK",53929
The Other Guys,2010,Action,Adam McKay,"Adam McKay, Chris Henchy","Will Ferrell, Derek Jeter, Mark Wahlberg, Eva Mendes","English, Ukrainian",USA,119219978
Best Worst Movie,2009,Documentary,Michael Paul Stephenson,N/A,"George Hardy, Lily Hardy, Pita Ray, Micki Knox","English, Italian",USA,103194
Doubt,2008,Drama,John Patrick Shanley,"John Patrick Shanley (screenplay), John Patrick Shanley (play)","Meryl Streep, Philip Seymour Hoffman, Amy Adams, Viola Davis",English,USA,33422556
Hamari Adhuri Kahani,2015,Drama,Mohit Suri,"Mahesh Bhatt, Shagufta Rafique (dialogue)","Rajkummar Rao, Vidya Balan, Emraan Hashmi, Amala Akkineni",Hindi,India,235361
Eat That Question: Frank Zappa in His Own Words,2016,Documentary,Thorsten Schutte,N/A,"Steve Allen, Angel, Chuck Ash, Arthur Barrow",English,"France, Germany",354981
Mirrors,2008,Horror,Alexandre Aja,"Alexandre Aja (screenplay), Gregory Levasseur (screenplay), Sung-ho Kim (Korean motion picture ""Into the Mirror"")","Kiefer Sutherland, Paula Patton, Cameron Boyce, Arika Gluck",English,"USA, Romania, Germany",30575158
Contracted,2013,Drama,Eric England,Eric England,"Najarra Townsend, Caroline Williams, Alice Macdonald, Matt Mercer",English,USA,3328
The Black Power Mixtape 1967-1975,2011,Documentary,Goran Olsson,Goran Olsson,"Abiodun Oyewole, Stokely Carmichael, Talib Kweli, Mable Carmichael","English, Swedish","Sweden, USA",167360
Cake,2014,Drama,Daniel Barnz,Patrick Tobin (screenplay),"Jennifer Aniston, Adriana Barraza, Anna Kendrick, Sam Worthington","English, Spanish",USA,1319947
My Friend Dahmer,2017,Biography,Marc Meyers,"Marc Meyers, John Backderf (based on the book My Friend Dahmer by)","Zachary Davis Brown, Lily Kozub, Ross Lynch, Vincent Kartheiser",English,USA,1306946
To the Arctic 3D,2012,Documentary,Greg MacGillivray,Stephen Judson,"Leanne Allison, Karsten Heuer, Bjorne Kvernmo, Simon Qamanirq",English,USA,14445922
Patti Cake$,2017,Drama,Geremy Jasper,Geremy Jasper,"Sahr Ngaujah, Danielle Macdonald, Bridget Everett, Mamoudou Athie",English,USA,794817
The Croods,2013,Animation,"Kirk DeMicco, Chris Sanders","Chris Sanders (screenplay), Kirk DeMicco (screenplay), John Cleese (story), Kirk DeMicco (story), Chris Sanders (story)","Nicolas Cage, Emma Stone, Ryan Reynolds, Catherine Keener",English,USA,187165546
And So It Goes,2014,Comedy,Rob Reiner,Mark Andrus,"Michael Douglas, Diane Keaton, Sterling Jerins, Annie Parisse",English,USA,10482672
The Hunger Games,2012,Action,Gary Ross,"Gary Ross (screenplay), Suzanne Collins (screenplay), Billy Ray (screenplay), Suzanne Collins (novel)","Stanley Tucci, Wes Bentley, Jennifer Lawrence, Willow Shields",English,USA,407981652
An Inconsistent Truth,2012,Documentary,Shayne Edwards,Phil Valentine,"Phil Valentine, Newt Gingrich, Jim DeMint, James Inhofe",English,USA,52756
The Monuments Men,2014,Comedy,George Clooney,"George Clooney (screenplay), Grant Heslov (screenplay), Robert M. Edsel (book), Bret Witter (book)","George Clooney, Matt Damon, Bill Murray, Cate Blanchett","English, German, Russian, French, Flemish, Dutch","USA, Germany",67239378
Twelve,2010,Action,Joel Schumacher,"Jordan Melamed (screenplay), Nick McDonell (novel)","Chace Crawford, Rory Culkin, Philip Ettinger, Esti Ginzburg",English,"USA, France",18159100
Frozen,2013,Animation,"Chris Buck, Jennifer Lee","Jennifer Lee (screenplay by), Hans Christian Andersen (story inspired by ""The Snow Queen"" by), Chris Buck (story by), Jennifer Lee (story by), Shane Morris (story by)","Kristen Bell, Idina Menzel, Jonathan Groff, Josh Gad","English, Norwegian",USA,400736600
Prometheus,2012,Adventure,Ridley Scott,"Jon Spaihts, Damon Lindelof, Dan O'Bannon (based on elements created by), Ronald Shusett (based on elements created by)","Noomi Rapace, Michael Fassbender, Charlize Theron, Idris Elba","English, Scottish Gaelic","USA, UK",126464904
Up,2009,Animation,"Pete Docter, Bob Peterson(co-director)","Pete Docter (story by), Bob Peterson (story by), Tom McCarthy (story by), Bob Peterson (screenplay by), Pete Docter (screenplay by)","Edward Asner, Christopher Plummer, Jordan Nagai, Bob Peterson",English,USA,292979556
Guzaarish,2010,Drama,Sanjay Leela Bhansali,"Sanjay Leela Bhansali (screenplay), Bhavani Iyer (dialogue), Bhavani Iyer (screenplay), Vibhu Puri (dialogue), Turaz (lyrics)","Hrithik Roshan, Aishwarya Rai Bachchan, Shernaz Patel, Aditya Roy Kapoor","Hindi, English",India,1017335
Afflicted,2013,Horror,"Derek Lee, Clif Prowse","Derek Lee (screenplay), Clif Prowse (screenplay)","Derek Lee, Clif Prowse, Michael Gill, Baya Rehaz","English, French, Italian","Canada, USA",121179
National Bird,2016,Documentary,Sonia Kennebeck,N/A,"Barack Obama, Jesselyn Radack","English, Dari",USA,10019
For No Good Reason,2012,Documentary,Charlie Paul,N/A,"Ralph Steadman, Johnny Depp, Hunter S. Thompson, Terry Gilliam",English,"UK, USA",67105
The Sorcerer's Apprentice,2010,Action,Jon Turteltaub,"Lawrence Konner (screen story), Mark Rosenthal (screen story), Matt Lopez (screen story), Matt Lopez (screenplay), Doug Miro (screenplay), Carlo Bernard (screenplay)","Nicolas Cage, Jay Baruchel, Alfred Molina, Teresa Palmer","English, Cantonese, Ukrainian",USA,63143812
Come Back to Me,2014,Fantasy,Paul Leyden,"Paul Leyden (screenplay by), Wrath James White (based on the book ""The Resurrectionist"" by)","Jon Abrahams, Andrew Beckham, Jeanette Branch, Caroline Clements",English,USA,4156
Boy,2010,Comedy,Taika Waititi,Taika Waititi,"James Rolleston, Te Aho Eketone-Whitu, Taika Waititi, Moerangi Tihore","English, Maori",New Zealand,242008
La danse,2009,Documentary,Frederick Wiseman,N/A,N/A,French,"France, USA",500000
The Visit,2015,Comedy,M. Night Shyamalan,M. Night Shyamalan,"Olivia DeJonge, Ed Oxenbould, Deanna Dunagan, Peter McRobbie",English,USA,56499874
Fun Size,2012,Adventure,Josh Schwartz,Max Werner,"Victoria Justice, Jackson Nicoll, Chelsea Handler, Josh Pence",English,USA,9402410
