,Unnamed: 0,Title,Year,Director,Writer,Actors,Genre,Language,Country,Runtime,BoxOffice
3,3,Gayby,2012,Jonathan Lisecki,Jonathan Lisecki,"Jenn Harris, Anna Margaret Hollyman, Matthew Wilkas, Christian Coulson",Comedy,English,USA,85,8387
4,4,Bol Bachchan,2012,Rohit Shetty,"Yunus Sajawal (screenplay), Sajid (dialogue), Farhad Samji (dialogue)","Amitabh Bachchan, Asin, Ajay Devgn, Abhishek Bachchan",Action,Hindi,India,155,1216258
6,6,Lincoln,2012,Steven Spielberg,"Tony Kushner (screenplay by), Doris Kearns Goodwin (based in part on the book ""Team of Rivals: The Political Genius of Abraham Lincoln"" by)","Daniel Day-Lewis, Sally Field, David Strathairn, Joseph Gordon-Levitt",Biography,English,USA,150,129477447
46,52,In Our Nature,2012,Brian Savelson,Brian Savelson,"Zach Gilford, Jena Malone, John Slattery, Gabrielle Union",Drama,English,USA,103,6175
51,58,The Guilt Trip,2012,Anne Fletcher,Dan Fogelman,"Barbra Streisand, Seth Rogen, Julene Renee, Zabryna Guevara",Comedy,English,USA,95,37101011
52,59,The Pirates! Band of Misfits,2012,"Peter Lord, Jeff Newitt(co-director)","Gideon Defoe (book), Gideon Defoe (screenplay)","Hugh Grant, Martin Freeman, Imelda Staunton, David Tennant",Animation,English,UK,88,31051126
64,72,Hating Breitbart,2012,Andrew Marcus,Andrew Marcus,"Andrew Breitbart, Orson Bean, Dick Armey, Michele Bachmann",Documentary,English,USA,85,81432
65,73,Stories We Tell,2012,Sarah Polley,"Sarah Polley, Michael Polley (narration)","Michael Polley, Harry Gulkin, Susy Buchan, John Buchan",Documentary,English,Canada,108,1599038
81,91,Jodi Breakers,2012,Ashwini Chaudhary,"Ashwini Chaudhary, Sanyukta Shaikh Chawla","Bipasha Basu, Helen, Pradeep Kharab, Madhavan",Comedy,Hindi,India,127,52618
86,96,My Brother the Devil,2012,Sally El Hosaini,Sally El Hosaini,"James Floyd, Fady Elsayed, Anthony Welsh, Amira Ghazalla",Crime,English,UK,111,10305
100,112,Crazy Eyes,2012,Adam Sherman,"Adam Sherman, Dave Reeves, Rachel Hardisty","Lukas Haas, Madeline Zima, Jake Busey, Tania Raymonde",Comedy,English,USA,95,6106
104,116,Dracula 3D,2012,Dario Argento,"Dario Argento (screenplay), Enrique Cerezo (screenplay), Stefano Piani (screenplay), Bram Stoker (book), Antonio Tentori (screenplay)","Thomas Kretschmann, Marta Gastini, Asia Argento, Unax Ugalde",Horror,English,Italy,110,3085
121,136,End of Watch,2012,David Ayer,David Ayer,"Jake Gyllenhaal, Michael Pena, Natalie Martinez, Anna Kendrick",Action,English,USA,109,39100000
140,160,Imogene,2012,"Shari Springer Berman, Robert Pulcini",Michelle Morgan,"Kristen Wiig, Annette Bening, Matt Dillon, Darren Criss",Comedy,English,USA,103,1378426
153,176,In the House,2012,Francois Ozon,"Juan Mayorga (play), Francois Ozon (screenplay)","Fabrice Luchini, Ernst Umhauer, Kristin Scott Thomas, Emmanuelle Seigner",Comedy,French,France,105,469746
154,177,Beware of Mr. Baker,2012,Jay Bulger,Jay Bulger,"Bob Adcock, Tony Allen, Carmine Appice, Brian Auger",Documentary,English,USA,100,65379
164,190,Shadow Dancer,2012,James Marsh,"Tom Bradby (screenplay), Tom Bradby (based on the novel by)","Barry Barnes, Maria Laird, Ben Smyth, Brid Brennan",Drama,English,UK,101,99134
210,240,Least Among Saints,2012,Martin Papazian,Martin Papazian,"Martin Papazian, Tristan Lake Leabu, Laura San Giacomo, Azura Skye",Crime,English,USA,107,28026
221,252,Looper,2012,Rian Johnson,Rian Johnson,"Joseph Gordon-Levitt, Bruce Willis, Emily Blunt, Paul Dano",Action,English,USA,113,66305045
223,254,Red Tails,2012,Anthony Hemingway,"John Ridley (story), John Ridley (screenplay), Aaron McGruder (screenplay), John B. Holway (book)","Terrence Howard, Cuba Gooding Jr., Nate Parker, David Oyelowo",Action,English,USA,125,49500000
237,271,Pitch Perfect,2012,Jason Moore,"Kay Cannon (screenplay), Mickey Rapkin (based on the book by)","Anna Kendrick, Skylar Astin, Ben Platt, Brittany Snow",Comedy,English,USA,112,61100000
266,306,Chasing Ice,2012,Jeff Orlowski,Mark Monroe,"James Balog, Svavar Jonatansson, Louie Psihoyos, Kitty Boone",Documentary,English,USA,75,1309997
283,325,The Summit,2012,Nick Ryan,Mark Monroe,"Christine Barnes, Hoselito Bite, Walter Bonatti, Marco Confortola",Documentary,English,Ireland,95,140269
304,348,Madagascar 3: Europe's Most Wanted,2012,"Eric Darnell, Tom McGrath, Conrad Vernon","Eric Darnell (screenplay), Noah Baumbach (screenplay), Marc Hyman (collaborating writer), Tom McGrath (characters by), Matt Shire (Punch-Up Writer)","Ben Stiller, Chris Rock, David Schwimmer, Jada Pinkett Smith",Animation,English,USA,93,216366733
306,350,The Magic of Belle Isle,2012,Rob Reiner,Guy Thomas,"Morgan Freeman, Kenan Thompson, Virginia Madsen, Emma Fuhrmann",Comedy,English,USA,109,66433
311,355,Resident Evil: Retribution,2012,Paul W.S. Anderson,Paul W.S. Anderson,"Milla Jovovich, Sienna Guillory, Michelle Rodriguez, Aryana Engineer",Action,English,Germany,95,42345531
320,365,Fill the Void,2012,Rama Burshtein,Rama Burshtein,"Hadas Yaron, Yiftach Klein, Irit Sheleg, Chayim Sharir",Drama,Hebrew,Israel,90,1130272
328,373,Kalakalappu,2012,Sundar C.,Cable Sankar,"Vimal, Shiva, Anjali, Oviya",Comedy,Tamil,India,135,30949
336,381,Mental,2012,P.J. Hogan,P.J. Hogan,"Rebecca Gibney, Hayley Magnus, Nicole Freeman, Chelsea Bennett",Comedy,English,Australia,116,2202208
342,388,The Company You Keep,2012,Robert Redford,"Lem Dobbs (screenplay by), Neil Gordon (based on the novel by)","Robert Redford, Shia LaBeouf, Julie Christie, Susan Sarandon",Drama,English,USA,125,5132442
346,392,Dabangg 2,2012,Arbaaz Khan,Dilip Shukla,"Salman Khan, Sonakshi Sinha, Prakash Raj, Vinod Khanna",Action,Hindi,India,120,2474674
348,395,In Another Country,2012,Sang-soo Hong,Sang-soo Hong (screenplay),"Isabelle Huppert, Joon-Sang Yoo, Yu-mi Jung, Yuh Jung Youn",Drama,Korean,South Korea,89,22139
352,399,Why Stop Now?,2012,"Phil Dorling, Ron Nyswaner","Phil Dorling (written for the screen by), Ron Nyswaner (written for the screen by), Phil Dorling (source material: 'Predisposed',  a short film written by), Ron Nyswaner (source material: 'Predisposed',  a short film written by)","Jesse Eisenberg, Melissa Leo, Tracy Morgan, Emma Rayne Lyle",Comedy,English,USA,85,1641
359,406,Project X,2012,Nima Nourizadeh,"Matt Drake (screenplay), Michael Bacall (screenplay), Michael Bacall (story)","Thomas Mann, Oliver Cooper, Jonathan Daniel Brown, Dax Flame",Comedy,English,USA,88,53400000
366,414,30 Beats,2012,Alexis Lloyd,Alexis Lloyd,"Condola Rashad, Justin Kirk, Jennifer Tilly, Jason Day",Comedy,English,France,88,14686
381,430,Beyond the Hills,2012,Cristian Mungiu,"Cristian Mungiu (screenplay), Tatiana Niculescu-Bran (inspired by non-fiction novels of)","Cosmina Stratan, Cristina Flutur, Valeriu Andriuta, Dana Tapalaga",Drama,Romanian,Romania,152,71701
385,435,Hellbound?,2012,Kevin Miller,Kevin Miller,"Kevin Miller, Jonathan Phelps, Margie Phelps, Robert McKee",Documentary,English,Canada,84,21920
386,436,Crooked Arrows,2012,Steve Rash,"Brad Riddell, Todd Baird","Brandon Routh, Gil Birmingham, Crystal Allen, Chelsea Ricketts",Drama,English,USA,105,1700000
388,438,Girl in Progress,2012,Patricia Riggen,Hiram Martinez (screenplay),"Eva Mendes, Matthew Modine, Cierra Ramirez, Patricia Arquette",Comedy,English,USA,93,2600000
401,452,Last Ounce of Courage,2012,"Darrel Campbell, Kevin McAfee","Darrel Campbell (book), Darrel Campbell (story), Gina Headrick (story), Richard Headrick (book), Richard Headrick (story)","Marshall R. Teague, Jennifer O'Neill, Rusty Joiner, Fred Williamson",Drama,English,USA,101,3310439
403,454,Grandmaster,2012,B. Unnikrishnan,"Agatha Christie (novel), B. Unnikrishnan","Mohanlal, Priyamani, Babu Antony, Arjun Nandakumar",Mystery,Malayalam,India,100,17077
411,463,Sparkle,2012,Salim Akil,"Mara Brock Akil (screenplay), Joel Schumacher (story), Howard Rosenman (story)","Jordin Sparks, Whitney Houston, Derek Luke, Mike Epps",Drama,English,USA,116,24397469
412,464,Young and Wild,2012,Marialy Rivas,"Marialy Rivas, Pedro Peirano, Sebastian Sepulveda, Camila Gutierrez","Alicia Rodriguez, Aline Kuppenheim, Maria Gracia Omegna, Felipe Pinto",Comedy,Spanish,Chile,96,3798
415,467,The Cold Light of Day,2012,Mabrouk El Mechri,"Scott Wiper, John Petro","Henry Cavill, Veronica Echegui, Bruce Willis, Sigourney Weaver",Action,English,USA,93,3700000
418,471,How to Make Money Selling Drugs,2012,Matthew Cooke,"Matthew Cooke, Grant Jolly (story editor)","Woody Harrelson, Susan Sarandon, 50 Cent, Eminem",Documentary,English,USA,96,15285
428,481,Paulette,2012,Jerome Enrico,"Laurie Aubanel (scenario), Jerome Enrico (dialogue), Jerome Enrico (scenario), Bianca Olsen (original idea), Bianca Olsen (scenario), Cyril Rambour (scenario)","Bernadette Lafont, Carmen Maura, Dominique Lavanant, Francoise Bertin",Comedy,French,France,87,9548
432,485,Dislecksia: The Movie,2012,Harvey Hubbell V,"Eric Gardner, Harvey Hubbell V","Billy Blanks, Sarah Brown, Stephen J. Cannell, Rashad Frett",Documentary,English,USA,83,2213
433,486,California Solo,2012,Marshall Lewy,Marshall Lewy,"Danny Masterson, Robert Carlyle, Kathleen Wilhoite, A Martinez",Drama,English,USA,94,15328
439,492,My Uncle Rafael,2012,Marc Fusco,"Scott Yagemann, Vahik Pirhamzei, Vahik Pirhamzei (characters from the play ""Rafael Keroo Gandzere"")","John Michael Higgins, Missi Pyle, Vahik Pirhamzei, Anthony Clark",Comedy,English,USA,102,210156
440,493,Deadfall,2012,Stefan Ruzowitzky,Zach Dean,"Eric Bana, Olivia Wilde, Charlie Hunnam, Dennis Lafond",Crime,English,France,95,38734
442,495,Universal Soldier: Day of Reckoning,2012,John Hyams,"John Hyams (screenplay), Doug Magnuson (screenplay), Jon Greenhalgh (screenplay), John Hyams (story), Moshe Diamant (story), Richard Rothstein (based on characters created by), Christopher Leitch (based on characters created by)","Jean-Claude Van Damme, Dolph Lundgren, Scott Adkins, Mariah Bonner",Action,English,USA,114,3500
445,499,Liberal Arts,2012,Josh Radnor,Josh Radnor,"Josh Radnor, Elizabeth Olsen, Richard Jenkins, Allison Janney",Comedy,English,USA,97,317190
447,501,China Heavyweight,2012,Yung Chang,Yung Chang,"Zongli He, Yunfei Miao, Moxiang Qi, Ye Xinchun",Documentary,Chinese,Canada,94,10481
460,516,Come Out and Play,2012,Makinov,"Makinov (screenplay), Juan Jose Plans (novel)","Vinessa Shaw, Ebon Moss-Bachrach, Daniel Gimenez Cacho, Gerardo Taracena",Horror,English,Mexico,87,1600
477,535,The Bay,2012,Barry Levinson,"Michael Wallach (screenplay by), Barry Levinson (story by), Michael Wallach (story by)","Nansi Aluka, Christopher Denham, Stephen Kunken, Frank Deal",Horror,English,USA,84,30474
479,537,Passion,2012,Brian De Palma,"Brian De Palma, Natalie Carter (film ""Crime d'amour""), Alain Corneau (film ""Crime d'amour""), Natalie Carter (additional dialogue)","Rachel McAdams, Noomi Rapace, Karoline Herfurth, Paul Anderson",Drama,English,France,102,57741
480,538,An Oversimplification of Her Beauty,2012,Terence Nance,Terence Nance,"Alisa Becher, Jc Cain, Dexter Jones, Namik Minter",Animation,English,USA,84,42308
488,547,The Bourne Legacy,2012,Tony Gilroy,"Tony Gilroy (screenplay), Dan Gilroy (screenplay), Tony Gilroy (story), Robert Ludlum (inspired by ""The Bourne Series"" created by)","Jeremy Renner, Scott Glenn, Stacy Keach, Edward Norton",Action,English,USA,135,113165635
498,558,Zero Dark Thirty,2012,Kathryn Bigelow,Mark Boal,"Jason Clarke, Reda Kateb, Jessica Chastain, Kyle Chandler",Drama,English,USA,157,95720716
500,560,Vicky Donor,2012,Shoojit Sircar,"Juhi Chaturvedi (dialogue), Juhi Chaturvedi (screenplay), Juhi Chaturvedi (story)","Ayushmann Khurrana, Yami Gautam, Annu Kapoor, Dolly Ahluwalia",Comedy,Hindi,India,126,466467
501,561,Dredd,2012,Pete Travis,"John Wagner (characters), Carlos Ezquerra (characters), Alex Garland (screenplay)","Karl Urban, Rachel Wood, Andile Mngadi, Porteus Xandau",Action,English,UK,95,13401683
502,563,Good Deeds,2012,Tyler Perry,Tyler Perry (screenplay),"Tyler Perry, Thandie Newton, Gabrielle Union, Eddie Cibrian",Comedy,English,USA,110,35010192
507,569,Reality,2012,Matteo Garrone,"Matteo Garrone (story), Massimo Gaudioso (story), Ugo Chiti (screenplay), Maurizio Braucci (screenplay), Matteo Garrone (screenplay), Massimo Gaudioso (screenplay)","Aniello Arena, Loredana Simioli, Nando Paone, Nello Iorio",Comedy,Italian,Italy,116,44768
519,582,Diary of a Wimpy Kid: Dog Days,2012,David Bowers,"Maya Forbes (screenplay by), Wallace Wolodarsky (screenplay by), Jeff Kinney (based upon the book by)","Zachary Gordon, Steve Zahn, Robert Capron, Devon Bostick",Comedy,English,USA,94,49002815
522,585,The End of Time,2012,Peter Mettler,"Alexandra Rockingham Gill, Peter Mettler","Peter Mettler, Freya Blekman, Richie Hawtin, George Mikenberg",Documentary,English,Switzerland,109,3776
524,587,The Hobbit: An Unexpected Journey,2012,Peter Jackson,"Fran Walsh (screenplay), Philippa Boyens (screenplay), Peter Jackson (screenplay), Guillermo del Toro (screenplay), J.R.R. Tolkien (novel)","Ian McKellen, Martin Freeman, Richard Armitage, Ken Stott",Adventure,English,USA,169,303001229
526,589,"For a Good Time, Call...",2012,Jamie Travis,"Katie Anne Naylon, Lauren Miller Rogen","Lauren Miller Rogen, James Wolk, Ari Graynor, Justin Long",Comedy,English,USA,85,1200000
534,598,Piranha 3DD,2012,John Gulager,"Patrick Melton, Marcus Dunstan, Joel Soisson, Pete Goldfinger (characters), Josh Stolberg (characters)","Danielle Panabaker, Matt Bush, Katrina Bowden, Jean-Luc Bilodeau",Comedy,English,USA,83,370904
553,619,Frances Ha,2012,Noah Baumbach,"Noah Baumbach, Greta Gerwig","Greta Gerwig, Mickey Sumner, Michael Esper, Adam Driver",Comedy,English,USA,86,3900000
559,627,What to Expect When You're Expecting,2012,Kirk Jones,"Shauna Cross (screenplay), Heather Hach (screenplay), Heidi Murkoff (books)","Cameron Diaz, Jennifer Lopez, Elizabeth Banks, Chace Crawford",Comedy,English,USA,110,41102171
561,629,The Place Beyond the Pines,2012,Derek Cianfrance,"Derek Cianfrance (story), Ben Coccio (story), Derek Cianfrance (screenplay), Ben Coccio (screenplay), Darius Marder (screenplay)","Ryan Gosling, Craig Van Hook, Eva Mendes, Olga Merediz",Crime,English,USA,140,21300000
574,643,Far Out Isn't Far Enough: The Tomi Ungerer Story,2012,Brad Bernstein,Brad Bernstein,"Tomi Ungerer, Maurice Sendak, Jules Feiffer, Michael Patrick Hearn",Documentary,English,USA,98,33428
587,657,Magic Mike,2012,Steven Soderbergh,Reid Carolin,"Matthew McConaughey, Channing Tatum, Olivia Munn, Alex Pettyfer",Comedy,English,USA,110,113709992
588,658,Best Man Down,2012,Ted Koland,Ted Koland,"Justin Long, Jess Weixler, Tyler Labine, Addison Timlin",Comedy,English,USA,89,1842
593,663,Nature Calls,2012,Todd Rohal,Todd Rohal (screenplay),"Maura Tierney, Patton Oswalt, Robert Longstreet, Rob Riggle",Comedy,English,USA,79,382
603,674,The Giant Mechanical Man,2012,Lee Kirk,Lee Kirk,"Jenna Fischer, Chris Messina, Malin Akerman, Rich Sommer",Comedy,English,USA,94,5360
618,689,Promised Land,2012,Gus Van Sant,"John Krasinski (screenplay), Matt Damon (screenplay), Dave Eggers (story)","Matt Damon, Benjamin Sheeler, Terry Kinney, Carla Bianco",Drama,English,USA,106,7600000
619,690,Iron Sky,2012,Timo Vuorensola,"Jarmo Puskala (original concept), Johanna Sinisalo (based on a story by), Michael Kalesniko (screenplay by), Timo Vuorensola (screenplay by)","Julia Dietze, Christopher Kirby, Gotz Otto, Udo Kier",Action,English,Finland,93,66076
621,693,House at the End of the Street,2012,Mark Tonderai,"David Loucka (screenplay), Jonathan Mostow (story)","Jennifer Lawrence, Max Thieriot, Elisabeth Shue, Gil Bellows",Drama,English,Canada,101,31600000
633,705,Unfinished Song,2012,Paul Andrew Williams,Paul Andrew Williams,"Terence Stamp, Vanessa Redgrave, Gemma Arterton, Barry Martin",Comedy,English,UK,90,1676463
679,756,Thanks for Sharing,2012,Stuart Blumberg,"Stuart Blumberg, Matt Winston","Mark Ruffalo, Tim Robbins, Gwyneth Paltrow, Josh Gad",Comedy,English,USA,112,752929
691,769,Smashed,2012,James Ponsoldt,"Susan Burke, James Ponsoldt","Mary Elizabeth Winstead, Aaron Paul, Nick Offerman, Megan Mullally",Drama,English,USA,81,375981
698,777,Tere Naal Love Ho Gaya,2012,Mandeep Kumar,"Abhijeet Sandhu, Dhieyo Sandhu","Riteish Deshmukh, Genelia D'Souza, Om Puri, Tinnu Anand",Comedy,Hindi,India,130,177472
706,785,Searching for Sugar Man,2012,Malik Bendjelloul,"Malik Bendjelloul, Stephen 'Sugar' Segerman (article), Craig Bartholomew Strydom (article)","Stephen 'Sugar' Segerman, Dennis Coffey, Mike Theodore, Dan DiMaggio",Documentary,English,Sweden,86,3100000
715,795,Barfi!,2012,Anurag Basu,"Anurag Basu (story and screenplay), Tani Basu (story and screenplay), Sanjeev Dutta (dialogue)","Ranbir Kapoor, Priyanka Chopra, Ileana D'Cruz, Saurabh Shukla",Comedy,Hindi,India,151,2804874
716,796,Filly Brown,2012,"Youssef Delara, Michael D. Olmos",Youssef Delara,"Gina Rodriguez, Khool-Aid Rios, Jenni Rivera, Lou Diamond Phillips",Drama,English,USA,80,2818020
719,800,Life of Pi,2012,Ang Lee,"Yann Martel (novel), David Magee (screenplay)","Suraj Sharma, Irrfan Khan, Ayush Tandon, Gautam Belur",Adventure,English,USA,127,103500000
723,804,Compliance,2012,Craig Zobel,Craig Zobel,"Ann Dowd, Matt Servitto, Dreama Walker, Pat Healy",Biography,English,USA,90,318622
730,813,Thaandavam,2012,Vijay,"Nigel Genis (scene), Mike Parish, Vijay","Vikram, Jagapathi Babu, Anushka Shetty, Amy Jackson",Action,Tamil,India,160,212145
743,827,The Paperboy,2012,Lee Daniels,"Peter Dexter (screenplay by), Lee Daniels (screenplay by), Peter Dexter (based on the novel by)","Zac Efron, Matthew McConaughey, Nicole Kidman, John Cusack",Crime,English,USA,107,692640
745,829,The End of Love,2012,Mark Webber,Mark Webber (screenplay),"Isaac Love, Mark Webber, Amanda Seyfried, Jason Ritter",Drama,English,USA,89,8326
753,838,The Words,2012,"Brian Klugman, Lee Sternthal","Brian Klugman, Lee Sternthal","Dennis Quaid, John Hannah, Jeremy Irons, Bradley Cooper",Drama,English,USA,102,11434867
755,840,Jack & Diane,2012,Bradley Rust Gray,Bradley Rust Gray,"Juno Temple, Jackson Ning, Samantha Ives, Anika Jennie Ji",Drama,English,USA,110,1041
766,852,Nitro Circus: The Movie,2012,"Gregg Godfrey, Jeremy Rawle","Gregg Godfrey, Travis Pastrana, Jeremy Rawle","Travis Pastrana, Jolene Van Vugt, Tommy Passemante, Jim DeChamp",Documentary,English,USA,92,3376905
784,872,On the Other Side of the Tracks,2012,David Charhon,"Eric Altmayer (original idea), Nicolas Altmayer (original idea), David Charhon (screenplay), Alexis Dolivet (adaptation), Remy Four (screenplay), Laurent Lafitte (adaptation), Julien War (screenplay)","Omar Sy, Laurent Lafitte, Sabrina Ouazani, Lionel Abelanski",Action,French,France,96,5923
803,894,Hyde Park on Hudson,2012,Roger Michell,Richard Nelson,"Bill Murray, Laura Linney, Samuel West, Olivia Colman",Biography,English,UK,94,6367780
815,907,Agent Vinod,2012,Sriram Raghavan,"Arijit Biswas (story), Sriram Raghavan (story)","Kareena Kapoor, Saif Ali Khan, Adil Hussain, Gulshan Grover",Action,Hindi,India,157,632446
820,914,A Dark Truth,2012,Damian Lee,Damian Lee,"Lloyd Adams, Alfredo Alvarez Calderon, Josh Bainbridge, Danielle Baker",Action,English,Canada,106,5750
821,916,Journey 2: The Mysterious Island,2012,Brad Peyton,"Brian Gunn (screenplay), Mark Gunn (screenplay), Richard Outten (story), Brian Gunn (story), Mark Gunn (story), Jules Verne (novel)","Dwayne Johnson, Michael Caine, Josh Hutcherson, Luis Guzman",Action,English,USA,94,103812241
824,919,Contraband,2012,Baltasar Kormakur,"Aaron Guzikowski (screenplay), Arnaldur Indridason (film ""Reykjavik-Rotterdam""), Oskar Jonasson (film ""Reykjavik-Rotterdam"")","Robert Wahlberg, Caleb Landry Jones, Jason Mitchell, Paul LeBlanc",Action,English,USA,109,66489425
840,936,On the Road,2012,Walter Salles,"Jack Kerouac (based on the novel by), Jose Rivera (screenplay by)","Sam Riley, Garrett Hedlund, Kristen Stewart, Amy Adams",Adventure,English,France,124,665094
845,943,Django Unchained,2012,Quentin Tarantino,Quentin Tarantino,"Jamie Foxx, Christoph Waltz, Leonardo DiCaprio, Kerry Washington",Drama,English,USA,165,162804648
846,944,Safe House,2012,Daniel Espinosa,David Guggenheim,"Denzel Washington, Ryan Reynolds, Vera Farmiga, Brendan Gleeson",Action,English,South Africa,115,126149655
856,956,The Sessions,2012,Ben Lewin,"Ben Lewin (written for the screen by), Mark O'Brien (article)","John Hawkes, Helen Hunt, William H. Macy, Moon Bloodgood",Biography,English,USA,95,5997134
873,975,Rock of Ages,2012,Adam Shankman,"Justin Theroux (screenplay by), Chris D'Arienzo (screenplay by), Allan Loeb (screenplay by), Chris D'Arienzo (based on the musical ""Rock of Ages"" written by)","Julianne Hough, Dakota Sage Grant, Matthew Rush Sullivan, Diego Boneta",Comedy,English,USA,123,38509342
880,983,Girls Against Boys,2012,Austin Chick,Austin Chick,"Nicole LaLiberte, Danielle Panabaker, Matthew Rauch, Liam Aiken",Drama,English,USA,93,6111
886,989,One for the Money,2012,Julie Anne Robinson,"Stacy Sherman (screenplay), Karen Ray (screenplay), Liz Brixius (screenplay), Janet Evanovich (novel)","Katherine Heigl, Jason O'Mara, Daniel Sunjata, John Leguizamo",Action,English,USA,91,26100000
895,1000,It's a Disaster,2012,Todd Berger,Todd Berger,"Rachel Boston, Kevin M. Brennan, David Cross, America Ferrera",Comedy,English,USA,88,57216
902,1007,One Me and One You,2012,Shakun Batra,"Shakun Batra, Ayesha DeVitre","Kareena Kapoor, Imran Khan, Boman Irani, Zenobia Shroff",Comedy,Hindi,India,110,1153360
915,1024,Bettie Page Reveals All,2012,Mark Mori,Douglas Miller,"Bettie Page, Hugh Hefner, Olivia de Berardinis, Dita Von Teese",Documentary,English,USA,101,102378
916,1026,The Apparition,2012,Todd Lincoln,Todd Lincoln,"Ashley Greene, Sebastian Stan, Tom Felton, Julianna Guill",Horror,English,USA,82,4700000
917,1027,Wrath of the Titans,2012,Jonathan Liebesman,"Dan Mazeau (screenplay), David Leslie Johnson-McGoldrick (screenplay), Greg Berlanti (story), David Leslie Johnson-McGoldrick (story), Dan Mazeau (story), Beverley Cross","Sam Worthington, Liam Neeson, Ralph Fiennes, Edgar Ramirez",Action,English,Spain,99,83640426
919,1029,ParaNorman,2012,"Chris Butler, Sam Fell",Chris Butler,"Kodi Smit-McPhee, Tucker Albrizzi, Anna Kendrick, Casey Affleck",Animation,English,USA,92,55994557
924,1034,Love in the Buff,2012,Ho-Cheung Pang,"Jody Luk, Yee-sum Luk (screenplay), Ho-Cheung Pang (based on characters created by), Ho-Cheung Pang (screenplay)","Miriam Chin Wah Yeung, Shawn Yue, Mi Yang, Zheng Xu",Comedy,Cantonese,Hong Kong,112,254712
929,1039,Paradise: Love,2012,Ulrich Seidl,"Ulrich Seidl (screenplay), Veronika Franz (screenplay)","Margarete Tiesel, Peter Kazungu, Inge Maux, Dunja Sowinetz",Drama,German,Austria,120,16952
969,1085,ATM,2012,David Brooks,"Chris Sparling (screenplay), Chris Sparling (story), Ron Tippe (story)","Brian Geraghty, Alice Eve, Josh Peck, Mike O'Brian",Horror,English,USA,90,2034
971,1087,The Amazing Spider-Man,2012,Marc Webb,"James Vanderbilt (screenplay), Alvin Sargent (screenplay), Steve Kloves (screenplay), James Vanderbilt (story), Stan Lee (based on the Marvel comic book by), Steve Ditko (based on the Marvel comic book by)","Andrew Garfield, Emma Stone, Rhys Ifans, Denis Leary",Action,English,USA,136,262030663
972,1088,Kon-Tiki,2012,"Joachim Ronning, Espen Sandberg",Petter Skavlan,"Pal Sverre Hagen, Anders Baasmo Christiansen, Tobias Santelmann, Gustaf Skarsgard",Adventure,Norwegian,UK,118,1511798
980,1096,The Sapphires,2012,Wayne Blair,"Keith Thompson, Tony Briggs, Tony Briggs (adapted from the stage play by)","Tanika Lonesborough, Nioka Brennan, Lynette Narkle, Kylie Belling",Biography,English,Australia,103,2400000
1004,1122,Moonrise Kingdom,2012,Wes Anderson,"Wes Anderson, Roman Coppola","Bruce Willis, Edward Norton, Bill Murray, Frances McDormand",Adventure,English,USA,94,45507865
1016,1135,Greedy Lying Bastards,2012,Craig Scott Rosebraugh,"Patrick Gambuti Jr., Craig Scott Rosebraugh","Enoch Adams, George W. Bush, Philip Cooney, Kert Davies",Documentary,English,USA,90,45000
1024,1143,Nobody Walks,2012,Ry Russo-Young,"Lena Dunham, Ry Russo-Young","John Krasinski, Olivia Thirlby, Rosemarie DeWitt, India Ennenga",Drama,English,USA,83,24995
1041,1160,Call Me Kuchu,2012,"Katherine Fairfax Wright, Malika Zouhali-Worrall","Katherine Fairfax Wright, Malika Zouhali-Worrall","David Bahati, David Kato, Gilles Muhame, Naome Ruzindana",Documentary,English,USA,87,8941
1045,1164,Husbands in Goa,2012,Saji Surendran,Krishna Poojappura,"Asif Ali, Indrajith, Jayasurya, Lal",Comedy,Malayalam,India,140,10135
1049,1168,A Hijacking,2012,Tobias Lindholm,Tobias Lindholm,"Pilou Asbaek, Soren Malling, Dar Salim, Roland Moller",Drama,Danish,Denmark,103,269428
1057,1176,La pirogue,2012,Moussa Toure,"Abasse Ndione (novel), Eric Neve (scenario and dialogue), David Bouchet (scenario and dialogue)","Souleymane Seye Ndiaye, Laity Fall, Malamine 'Yalenguen' Drame, Balla Diarra",Drama,French,France,87,11165
1058,1177,Silent Night,2012,Steven C. Miller,Jayson Rothwell (screenplay by),"Malcolm McDowell, Jaime King, Donal Logue, Rick Skene",Comedy,English,Canada,94,9672
1060,1179,Price Check,2012,Michael Walker,Michael Walker,"Eric Mabius, Matt Servitto, Annie Parisse, Finn Donoghue",Comedy,English,USA,92,4669
1074,1193,The Pervert's Guide to Ideology,2012,Sophie Fiennes,Slavoj Zizek (screenplay),Slavoj Zizek,Documentary,English,UK,136,66236
1081,1200,The Angels' Share,2012,Ken Loach,Paul Laverty (screenplay),"Paul Brannigan, Siobhan Reilly, John Henshaw, Gary Maitland",Comedy,English,UK,101,687405
1091,1210,Step Up Revolution,2012,Scott Speer,"Amanda Brody, Duane Adler (characters)","Cleopatra Coleman, Ryan Guzman, Misha Gabriel Hamilton, Michael 'Xeno' Langebeck",Drama,English,USA,99,35057332
1095,1214,Argo,2012,Ben Affleck,"Chris Terrio (screenplay by), Tony Mendez (based on a selection from ""The Master of Disguise"" by), Joshuah Bearman (based on the Wired Magazine article ""The Great Escape"" by)","Ben Affleck, Bryan Cranston, Alan Arkin, John Goodman",Biography,English,USA,120,136019448
